ID,Risk Title,Description,Asset / Process,Threat,Vulnerability,Owner,Likelihood (1-5),Impact (1-5),Inherent Score,Existing Controls,Residual Likelihood,Residual Impact,Residual Score,Treatment Decision,Status
R-001,Ransomware on file servers,Attackers encrypt central file share and backup shares via compromised admin account,File server FS-01 + central SMB share,Ransomware,Flat admin network, shared backup credentials,IT Operations Lead,4,5,20,EDR, MFA on admin accounts, offline backups, network segmentation partially in place,2,4,8,Mitigate,Open
R-002,Phishing leading to credential compromise,Employee enters credentials on cloned M365 login page,All user accounts,Phishing,User awareness gap, no phishing-resistant MFA,ISO,4,4,16,Mail filter, Security awareness training, phishing simulations, MFA (TOTP),3,3,9,Mitigate,Open
R-003,Insider data exfiltration via personal email,Leaving employee sends customer list to private Gmail,Customer database,Malicious insider,Weak DLP on outbound email, broad access to CRM,HR Lead,2,4,8,NDA, role-based access, leaver process,2,3,6,Mitigate,Open
R-004,Supplier outage affecting logistics portal,Critical SaaS provider suffers 8h outage during peak period,Logistics portal (SaaS),Supplier outage,Single provider, no fallback process,IT Operations Lead,3,4,12,SLA, incident monitoring, manual fallback checklist,3,3,9,Accept with monitoring,Open
R-005,GDPR breach via misconfigured S3 bucket,Public bucket exposes 2000 customer records,Marketing bucket s3://nwl-marketing,Misconfiguration,No IaC review, no scheduled bucket audit,DPO,3,5,15,Quarterly config audit, bucket policy template,2,4,8,Mitigate,In treatment
